{
  "name": "stays-triage-rules",
  "version": "0.1.0",
  "capability": "stays.triage@0.1",
  "mcp": {
    "server": "metis.stays",
    "tool": "triage",
    "transport": "stdio"
  },
  "idempotent": true,
  "isolation": "process",
  "inputSchema": {
    "$ref": "../../capabilities/stays.triage@0.1.input.schema.json"
  },
  "outputSchema": {
    "$ref": "../../capabilities/stays.triage@0.1.output.schema.json"
  },
  "authScopes": [],
  "tests": [
    {
      "name": "minimal",
      "input": {
        "messages": "Anyone with a 1br in Westlands for tonight?"
      },
      "expect": {
        "type": "object",
        "required": [
          "results",
          "markdown"
        ]
      }
    }
  ]
}
