{
  "name": "stays-availability-sheet",
  "version": "0.1.0",
  "capability": "stays.availability@0.1",
  "mcp": {
    "server": "metis.stays",
    "tool": "availability",
    "transport": "stdio"
  },
  "idempotent": true,
  "isolation": "process",
  "inputSchema": {
    "$ref": "../../capabilities/stays.availability@0.1.input.schema.json"
  },
  "outputSchema": {
    "$ref": "../../capabilities/stays.availability@0.1.output.schema.json"
  },
  "authScopes": [
    "google.sheets.read"
  ],
  "tests": [
    {
      "name": "minimal",
      "input": {
        "checkIn": "2026-11-15",
        "checkOut": "2026-11-18"
      },
      "expect": {
        "type": "object",
        "required": [
          "verdict"
        ]
      }
    }
  ]
}
