{
  "name": "design-prd-basic",
  "version": "1.0.0",
  "capability": "design.prd@1.0",
  "mcp": {
    "server": "metis.design",
    "tool": "prd",
    "transport": "stdio"
  },
  "idempotent": true,
  "isolation": "process",
  "inputSchema": {
    "$ref": "../../capabilities/design.prd@1.0.input.schema.json"
  },
  "outputSchema": {
    "$ref": "../../capabilities/design.prd@1.0.output.schema.json"
  },
  "authScopes": [],
  "tests": [
    {
      "name": "minimal",
      "input": {
        "title": "Hello"
      },
      "expect": {
        "type": "object",
        "required": [
          "markdown"
        ]
      }
    }
  ]
}
