{
  "name": "graph-link-basic",
  "version": "0.1.0",
  "capability": "graph.link@0.1",
  "mcp": {
    "server": "metis.memory",
    "tool": "link",
    "transport": "stdio"
  },
  "idempotent": true,
  "isolation": "process",
  "inputSchema": {
    "$ref": "../../capabilities/graph.link@0.1.input.schema.json"
  },
  "outputSchema": {
    "$ref": "../../capabilities/graph.link@0.1.output.schema.json"
  },
  "authScopes": ["memory.write"],
  "tests": [
    {
      "name": "simple",
      "input": {
        "from": "doc:1",
        "rel": "mentions",
        "to": "entity:abc"
      },
      "expect": {
        "type": "object",
        "required": [
          "ok"
        ]
      }
    }
  ]
}
